{
  "$schema": "https://json-schema.org/draft/2020-12/schema",
  "$id": "https://ai-native-methodology/schemas/discovery-spec.schema.json",
  "title": "Discovery Spec (chain discovery / 기획 의도)",
  "description": "v11.0.0 MAJOR — `planning-spec` → `discovery-spec` rename (DEC-2026-05-26-discovery-spec-rename 정합). chain harness 안 discovery stage 산출물. legacy 분석 결과 + 입력 어댑터 4종 (analysis-output / swagger / figma / nl-md) → 비즈니스 의도 추출. discovery stage = cross-cut 단일 산출물 (BE/FE 양쪽 자연 가로지름 — DEC-2026-05-26-be-fe-산출물-분리 §1 정합). ID 컨벤션: methodology-spec/id-conventions.md.",
  "type": "object",
  "required": ["meta", "derivation_source", "business_intent", "use_cases"],
  "additionalProperties": true,
  "$comment_additionalProperties": "v8.6.0+ F-V2C2-1-02 R#4 fix — PoC 부가 top-level keys (business_rules / migration_priority_summary / phase_4_7_acceptance_oracle / sql_inventory_summary / discovery_validator_pass / $3_axis_alignment 등) 허용. drift attractor 차단은 v11.x carry — 권장 위치 = `extra` field (meta-confidence 와 동일 패턴).",
  "properties": {
    "meta": {
      "$ref": "./meta-confidence.schema.json"
    },
    "derivation_source": {
      "type": "object",
      "description": "본 discovery-spec 의 출처. v11.0.0 = 4 입력 어댑터 + legacy-extraction 모두 정합 (analysis-output / swagger / figma / nl-md).",
      "required": ["type", "source_artifacts"],
      "additionalProperties": false,
      "$comment": "v8.10.0 — source_handling + source_root_absolute 명시 properties 추가 (DEC-2026-05-12-in-place-read-정책-채택 정합 / poc-11 실측 정식 흡수 / additive). additionalProperties:false 유지 = drift attractor 차단 본질 보존. v11.0.0 — input 어댑터 4종 정합 (DEC-2026-05-26-input-skill-roles).",
      "properties": {
        "type": {
          "type": "string",
          "enum": ["legacy-extraction", "new-prd", "modification", "bugfix"],
          "description": "기획 input 출처. v11.0.0 = legacy-extraction (analysis stage 산출물 채널) / new-prd (nl-md + figma + swagger 채널) / modification + bugfix (delta 갱신) 모두 정합."
        },
        "source_artifacts": {
          "type": "array",
          "description": "본 discovery-spec 추출에 사용된 analysis stage 산출물 + 입력 어댑터 산출물 경로 (business-rules.json / domain.json / openapi.yaml / schema.json / antipatterns.json / migration-cautions.md / 8 FE 산출물 / Phase 4.5 / swagger-extract.json / figma-extract.json / nl-md prompt-extract.json)",
          "items": {"type": "string"},
          "minItems": 1
        },
        "source_handling": {
          "type": "string",
          "description": "v8.10.0 — source 처리 paradigm (DEC-2026-05-12-in-place-read-정책-채택 정합 / 예: 'in-place read (사본 ❌)')"
        },
        "source_root_absolute": {
          "type": "string",
          "description": "v8.10.0 — source 절대경로 (in-place read paradigm 시 reference / poc-11 사례)"
        }
      }
    },
    "business_intent": {
      "type": "object",
      "description": "비즈니스 의도 — 도메인 목적 / 이해관계자 / 성공 기준",
      "required": ["domain_purpose"],
      "additionalProperties": false,
      "properties": {
        "domain_purpose": {"type": "string", "description": "도메인의 비즈니스 목적 한 줄"},
        "stakeholders": {
          "type": "array",
          "items": {"type": "string"},
          "description": "이해관계자 목록"
        },
        "success_criteria": {
          "type": "array",
          "items": {"type": "string"},
          "description": "성공 기준 (KPI / 정성)"
        }
      }
    },
    "use_cases": {
      "type": "array",
      "description": "유스케이스 목록. analysis stage domain.json 의 UC-* 를 chain spec forward link 가능한 형태로 정리. v11.0.0 = cross-cut anchor (BE/FE 양쪽 가로지름 / DEC-2026-05-26-be-fe-산출물-분리 §1 정합).",
      "items": {
        "type": "object",
        "required": ["id", "description", "acceptance_criteria_refs"],
        "additionalProperties": true,
        "$comment_additionalProperties": "v8.6.0+ F-V2C2-1-02 R#4 fix — UC 부가 keys (note / rationale 등) 허용",
        "properties": {
          "id": {
            "type": "string",
            "pattern": "^UC-[A-Z0-9_-]+-[0-9]{3}$",
            "description": "유스케이스 ID (id-conventions canonical / 예: UC-USER-001)"
          },
          "name": {"type": "string"},
          "description": {"type": "string"},
          "actors": {
            "type": "array",
            "items": {"type": "string"}
          },
          "preconditions": {
            "type": "array",
            "items": {"type": "string"}
          },
          "postconditions": {
            "type": "array",
            "items": {"type": "string"}
          },
          "acceptance_criteria_refs": {
            "type": "array",
            "items": {
              "type": "string",
              "pattern": "^AC-[A-Z0-9_-]+-[0-9]{3}$"
            },
            "minItems": 1,
            "description": "chain spec forward link 의무 (sub-plan-3 chain-coverage-validator 강제)"
          },
          "source_grounded_evidence": {
            "type": "array",
            "items": {"type": "string"},
            "description": "no-simulation — analysis 산출물 + 코드 경로 (예: src/user/UserService.java:45-60). source-grounded 의무 (B7 14차 retract 차단)"
          },
          "code_pointers": {
            "type": "array",
            "description": "operation.md 결정 3 + P2 — artifact ↔ code anchor. graph-synthesizer 가 artifact-graph-node.code_pointers 로 평탄화. code-pointer-validator(12번째) 가 검증.",
            "items": {"$ref": "./code-pointer.schema.json"}
          },
          "code_pointers_na": {
            "type": "boolean",
            "default": false,
            "description": "명시적 N/A 마커 (operation.md 결정 3). UC 가 코드 anchor 를 직접 가리키지 않는 경우 true (보통 analysis/aspect 에 사용)."
          },
          "existing_ticket_refs": {
            "type": "array",
            "description": "v12 델타 생성 (DEC-2026-06-10-ticket-delta-creation). discovery 입력(swagger/figma/nl-md)에서 본 UC 가 **이미 존재하는 Jira Epic/Story 에 매핑**됨을 전달받은 경우 기록. plan-decompose 가 task-plan epic_refs/story_refs 의 jira_id(+pre_existing=true)로 전파 → ticket-sync 가 생성 skip + 부모로만 사용 (델타만 생성). 미보유 시 신규 생성 경로.",
            "items": {
              "type": "object",
              "required": ["jira_id", "level"],
              "additionalProperties": false,
              "properties": {
                "jira_id": {"type": "string", "description": "기존 Jira 티켓 키 (예: MIS-201)"},
                "level": {"type": "string", "enum": ["epic", "story"], "description": "기존 티켓의 level (Epic = 화면 / Story = 기능)"},
                "title": {"type": "string", "description": "참조 title (선택 / 사람 확인용)"}
              }
            }
          },
          "difficulty": {
            "type": "object",
            "description": "S1 (MIS-373) — UC 난이도 reference-lens 스냅샷. artifact-graph 의존성 영향 정량(analyzeImpact merged_count). **결정론 정량만 / verdict ❌ / non-gating** — gate blocking[] inject 금지 (STRONG-STOP / feedback_chain_driver_deterministic_axis). 표시(HTML 뱃지)+검토권장(review[]) 전용. 부재/greenfield/UC 미합성 = degraded:true (정직 신호 / no-simulation). optional (backward-compat) — plan-review-server 가 렌더 시점 산출(미persist)하거나 skill 이 스냅샷 기록 시 본 필드.",
            "additionalProperties": false,
            "properties": {
              "bucket": {"type": ["string", "null"], "enum": ["S", "M", "L", null], "description": "영향 노드 수 버킷 (S 0..3 / M 4..9 / L 10+). degraded 시 null. verdict 아님(정량 분류)."},
              "impact_count": {"type": "integer", "minimum": 0, "description": "merged_count (forward+backward 영향 노드 수)"},
              "must_count": {"type": "integer", "minimum": 0, "description": "MUST(hard sync 강제) 영향 수"},
              "should_count": {"type": "integer", "minimum": 0},
              "fyi_count": {"type": "integer", "minimum": 0},
              "degraded": {"type": "boolean", "default": false, "description": "그래프 부재/UC 미합성 = 미산출 정직 신호"},
              "reason": {"type": "string", "description": "degraded 사유 (선택)"}
            }
          }
        }
      },
      "minItems": 1
    },
    "business_rules_intent": {
      "type": "array",
      "description": "analysis stage 의 BR-* 별 intent reasoning. BR-INTENT-* prefix 폐기 (Senior B1) — 본 필드 = analysis BR-* 의 backward link",
      "items": {
        "type": "object",
        "required": ["br_id", "reasoning", "source_grounded_evidence"],
        "additionalProperties": false,
        "properties": {
          "br_id": {
            "type": "string",
            "pattern": "^BR-[A-Z0-9_-]+-[A-Z0-9_-]+-[0-9]+$",
            "description": "analysis stage business-rules.json 의 BR-* (backward link)"
          },
          "reasoning": {
            "type": "string",
            "description": "왜 이 규칙인가 자연어 reasoning"
          },
          "source_grounded_evidence": {
            "type": "string",
            "description": "source-grounded 의무 (예: src/user/UserValidator.java:23 + git blame author)"
          },
          "intent_certainty": {
            "type": "string",
            "enum": ["observed", "inferred-consequence", "unverified-intent", "source-refuted"],
            "description": "v11.6.0 (F-DOGFOOD-003 / MyBatis+JPA arm ≥2 corroboration) — reasoning 의 intent 귀속 확실성 구조화 라벨. observed=코드에서 직접 관찰된 동작(fact) / inferred-consequence=동작의 사실적 결과는 맞으나 의도는 추론 / unverified-intent=의도 귀속이나 소스 근거(주석/ADR/commit) 부재 / source-refuted=귀속하려던 의도를 소스가 반증함. prose marker `[관찰]/[결과]/[미검증]` 의 구조화 승격 — over-attribution 을 validator 검증 가능하게 함 (Option C guardrail 미강제 보완). optional (backward-compat) / discovery-extraction-validator 가 부재 시 WARN."
          }
        }
      }
    },
    "out_of_scope": {
      "type": "array",
      "items": {"type": "string"},
      "description": "본 chain 에서 제외 영역 (자유서술)"
    },
    "excluded_antipatterns": {
      "type": "array",
      "items": {
        "type": "object",
        "required": ["ap_id", "reason"],
        "additionalProperties": false,
        "properties": {
          "ap_id": {
            "type": "string",
            "pattern": "^AP-[A-Z0-9_-]+-[0-9]{3}$",
            "description": "antipatterns.json AP-* ID 결정적 reference"
          },
          "reason": {
            "type": "string",
            "minLength": 5,
            "description": "본 PoC 가 본 AP 를 carry out 하는 사유 (carry contract)"
          },
          "decision_ref": {
            "type": "string",
            "description": "선택 — 관련 DEC.md 또는 ADR.md 식별자"
          }
        }
      },
      "description": "F-SIM-001 (2026-05-18): critical/high AP 를 본 chain 에서 명시 제외 — antipattern-coverage lane 의 carry contract. AC.related_aps 와 본 목록 둘 다 부재 시 chain-coverage-validator 가 finding emit (chain.ap.uncovered_severe). out_of_scope (자유서술 string array) 와 별개 — 결정적 ap_id 결합으로 silent omission 차단."
    },
    "risks_and_constraints": {
      "type": "array",
      "description": "위험 / 제약 (e.g., 70~80% 한계 / 라이선스 / 인프라 제약). v8.10.0 — polymorphic items: legacy string carry OR object {id, severity, description, type?} (5 PoC 실측 정식 흡수).",
      "items": {
        "anyOf": [
          {
            "type": "string",
            "$comment": "v8.10.0 — legacy carry 한정 (PoC v8.9.x 이전). 신규 PoC = object form 권장 (severity 결정적 추출 가능). v8.11.0+ chain-coverage-validator risks_string_form_warn lane = Senior REVISE-1 carry."
          },
          {
            "type": "object",
            "required": ["id", "severity", "description"],
            "additionalProperties": true,
            "$comment_additionalProperties": "v8.10.0 — PoC 부가 키 (type / category 등) 허용. drift attractor 차단은 chain-coverage-validator risks lane (v8.11.0 carry).",
            "properties": {
              "id": {
                "type": "string",
                "description": "위험 ID (예: R-001 / RISK-SEC-001)"
              },
              "severity": {
                "type": "string",
                "enum": ["critical", "high", "medium", "low"],
                "description": "v8.10.0 — severity-cross-stage-mapping.md SSOT 정합 (rules 5종↔ratchet 4종↔MoSCoW 3종)"
              },
              "description": {
                "type": "string",
                "minLength": 5,
                "description": "위험 / 제약 자연어 기술"
              },
              "type": {
                "type": "string",
                "description": "위험 분류 (예: security / performance / concurrency / design / paradigm / schema / type-safety)"
              }
            }
          }
        ]
      }
    },
    "decisions": {
      "type": "array",
      "description": "v8.7.5 결단 정식화 (Auto Mode 호환). discovery-extraction-validator §v8.7.5 거버넌스 검증 결선 (D4 / INSPECTION-2026-05-31).",
      "items": {
        "type": "object",
        "additionalProperties": false,
        "required": ["source"],
        "properties": {
          "$comment": { "type": "string" },
          "id": { "type": "string" },
          "topic": { "type": "string" },
          "source": { "type": "string", "enum": ["user-explicit", "AI-default", "AI-investigation-complete", "carry"] },
          "rationale": { "type": "string" },
          "affected_ids": { "type": "array", "items": { "type": "string" } },
          "revisit_required": { "type": "boolean" },
          "evidence_path": { "type": "string" }
        }
      }
    },
    "pending_decisions": {
      "type": "array",
      "description": "미결단 항목. non-empty 시 gate#1 user-explicit 전환 의무 (discovery-extraction-validator critical / gate stop / D4).",
      "items": {
        "type": "object",
        "additionalProperties": true,
        "properties": {
          "id": { "type": "string" },
          "topic": { "type": "string" }
        }
      }
    },
    "conflicts": {
      "type": "array",
      "description": "S3 (MIS-373) — 멀티 입력(어댑터 4종 출력) 수렴 시 표면화한 충돌·중복. Conflict Surface 4분류(research 패턴 D). **non-gating reference** — 해소는 decisions[]/pending_decisions 로 backward link (해소 자체는 사람 결정). 단일 입력이면 빈 배열. optional·backward-compat.",
      "items": {
        "type": "object",
        "additionalProperties": false,
        "required": ["id", "topic", "classification", "sources"],
        "properties": {
          "id": { "type": "string", "pattern": "^CONFLICT-[0-9]{3}$" },
          "topic": { "type": "string", "description": "충돌 주제 (1줄)" },
          "classification": { "type": "string", "enum": ["common-theme", "requirement-conflict", "political-vs-real", "technical-tradeoff"], "description": "4분류 (패턴 D): 공통테마 / 요구충돌 / 정치적포지션-vs-실제우려 / 기술트레이드오프" },
          "sources": { "type": "array", "minItems": 1, "items": { "type": "string" }, "description": "충돌하는 입력 출처 (어댑터 채널 또는 문서 ref). source_grounded 의무." },
          "description": { "type": "string" },
          "resolution_candidate": { "type": "string", "description": "다수 만족 가능 타협 후보 (사람 결정 전제 / AI 단독 확정 ❌)" },
          "resolved": { "type": "boolean", "default": false },
          "resolution_ref": { "type": "string", "description": "해소 시 decisions[].topic 또는 DEC ref (backward link)" }
        }
      }
    },
    "nfr": {
      "type": "array",
      "description": "비기능 요구 (swagger/figma/nl-md 어댑터 1차 추출). D3 / INSPECTION-2026-05-31 — schema 정의로 gate#1 schema-validator 검증 표면 확보 (이전 additionalProperties silent pass).",
      "items": {
        "type": "object",
        "additionalProperties": false,
        "required": ["id", "statement", "source_grounded_evidence"],
        "properties": {
          "id": { "type": "string", "pattern": "^NFR-[A-Z0-9_-]+-[0-9]+$", "description": "예: NFR-PERF-001" },
          "category": { "type": "string", "description": "ISO 25010 품질 특성 (performance_efficiency / security / reliability ...)" },
          "statement": { "type": "string", "minLength": 5 },
          "source_grounded_evidence": { "type": "string", "description": "출처 ref (no-simulation / openapi:path / doc:para / figma:node)" }
        }
      }
    },
    "io_contracts": {
      "type": "array",
      "description": "I/O 계약 (swagger 어댑터). D3 / INSPECTION-2026-05-31.",
      "items": {
        "type": "object",
        "additionalProperties": false,
        "required": ["operation_ref"],
        "properties": {
          "operation_ref": { "type": "string", "description": "openapi operationId 등" },
          "request_ref": { "type": "string" },
          "response_ref": { "type": "string" }
        }
      }
    },
    "intent_summary": {
      "type": "string",
      "description": "도메인 의도 요약 (nl-md 어댑터). business_intent.domain_purpose 와 중복 시 후자 우선 (D3 / INSPECTION-2026-05-31)."
    },
    "uc_dependencies": {
      "type": "array",
      "description": "S4 (MIS-373) — UC 간 의존성 reference-lens (artifact-graph analyzeImpact 파생). **non-gating / verdict ❌** (STRONG-STOP) — UC 분해·순서 검토 보조일 뿐 chain-coverage 강제 ❌. greenfield/그래프 부재 = 빈 배열(미산출). optional (backward-compat).",
      "items": {
        "type": "object",
        "additionalProperties": false,
        "required": ["from_uc", "to_uc"],
        "properties": {
          "from_uc": {"type": "string", "pattern": "^UC-[A-Z0-9_-]+-[0-9]{3}$", "description": "의존 출발 UC id"},
          "to_uc": {"type": "string", "description": "영향받는 노드 id (UC/BHV/AC 등 artifact-graph 노드)"},
          "grade": {"type": "string", "enum": ["MUST", "SHOULD", "FYI"], "description": "analyzeImpact 영향 등급 (감쇠 적용)"},
          "edge_type": {"type": "string", "description": "artifact-graph edge_type (derived_from/depends_on/implements 등)"},
          "direction": {"type": "string", "enum": ["forward", "backward", "both"], "description": "origin 기준 방향"}
        }
      }
    },
    "cross_links": {
      "type": "object",
      "description": "DO-178C bidirectional traceability 차용",
      "additionalProperties": false,
      "$comment": "v8.10.0 — 4 신규 enum 추가 (to_characterization / to_sql_inventory / to_source / to_decisions) — poc-07+poc-11 실측 정식 흡수. additionalProperties:false 유지 = drift attractor 차단 본질 보존 (Senior C3 권고).",
      "properties": {
        "to_analysis_artifacts": {
          "type": "array",
          "items": {"type": "string"},
          "description": "backward link to analysis 산출물 (business-rules.json / domain.json / 7대 산출물)"
        },
        "to_characterization": {
          "type": "array",
          "items": {"type": "string"},
          "description": "v8.10.0 — backward link to characterization 산출물 (characterization/snapshots/ 등 / analysis-characterization-test 정합)"
        },
        "to_sql_inventory": {
          "type": "array",
          "items": {"type": "string"},
          "description": "v8.10.0 — backward link to sql-inventory 산출물 (sql-inventory.json / analysis-sql-inventory 정합)"
        },
        "to_source": {
          "type": "array",
          "items": {"type": "string"},
          "description": "v8.10.0 — backward link to source 코드 (source/java/* + source/sqlmap/* 등 / source-grounded paradigm 정합)"
        },
        "to_decisions": {
          "type": "array",
          "items": {"type": "string"},
          "description": "v8.10.0 — backward link to decisions/ DEC.md (DEC-YYYY-MM-DD-* / discovery 결단 trace)"
        },
        "to_phase7_findings": {
          "type": "array",
          "items": {"type": "string"},
          "description": "v8.10.0 — backward link to Phase 4.7 findings (F-PHASE7-* / intent-vs-bug ambiguous 영역 trace / analysis-characterization-test 정합)"
        }
      }
    }
  }
}
