{
  "meta": {
    "generated_at": "2026-05-06T19:00:00Z",
    "methodology_version": "v2.0.0",
    "inputs_used": ["source_code", "design_specs", "diagrams_other"],
    "confidence": 0.80,
    "formula_version": "v1"
  },
  "derivation_source": {
    "type": "legacy-extraction",
    "source_artifacts": [
      "analysis/0-init/inventory.json",
      "analysis/5-2-a-ui-base/ui-spec.json",
      "analysis/5-2-b-state/state-map.json",
      "analysis/6-quality/form-validation-spec.json"
    ]
  },
  "business_intent": {
    "domain_purpose": "RealWorld React FSD — User authentication flow ( FE retrofit scope = Login page subset / corroboration #3 / Senior F7 BE-only 한계 부분 closure)",
    "stakeholders": ["end-user", "FE-team"],
    "success_criteria": [
      "올바른 자격증명으로 login 시 /settings 리다이렉트",
      "이메일 형식 위반 시 client-side validation error",
      "auth 실패 (401) 시 form 단위 error message"
    ]
  },
  "use_cases": [
    {
      "id": "UC-FE-LOGIN-001",
      "name": "Login (FE)",
      "description": "PAGE-LOGIN — Zod-validated email + password 입력 → POST /api/users/login → success 시 /settings 리다이렉트 / fail 시 form error.",
      "actors": ["anonymous"],
      "preconditions": ["사용자가 /login 페이지 진입"],
      "postconditions": ["JWT cookie 설정 + /settings 리다이렉트 (성공)", "form error message 표시 (실패)"],
      "acceptance_criteria_refs": ["AC-FE-LOGIN-001"],
      "source_grounded_evidence": [
        "analysis/5-2-a-ui-base/ui-spec.json PAGE-LOGIN + ACTION-USER-LOGIN"
      ]
    }
  ],
  "business_rules_intent": [
    {
      "br_id": "BR-FE-LOGIN-VALIDATION-001",
      "reasoning": "Zod LoginBody schema (analysis/6-quality/form-validation-spec.json) 가 client-side 의무 — 잘못된 이메일 형식 / 빈 password 차단으로 server round-trip 절감 + UX 개선.",
      "source_grounded_evidence": "analysis/6-quality/form-validation-spec.json BR-FE-LOGIN-* + LoginBody Zod schema"
    }
  ],
  "out_of_scope": [
    "PAGE-HOME / PAGE-SETTINGS / PAGE-ARTICLE ( retrofit subset OUT)",
    "logout / signup / password-reset flow ( subset OUT)",
    "진짜 React Testing Library 실행 ( chain 3 RED dry-run only / sub-plan-6 시간 제약)"
  ],
  "risks_and_constraints": [
    {"id": "R-001", "severity": "low", "type": "methodology", "description": "70~80% 자동화 한계 잔존 — gate 별 사용자 검토 의무"},
    {"id": "R-002", "severity": "medium", "type": "environment", "description": "본 PoC = chain 1~2 + chain 3 RED dry-run / chain 4 GREEN 미실행 (PoC #03 retrofit 패턴 정합 / corroboration #3 자격)"}
  ],
  "cross_links": {
    "to_analysis_artifacts": [
      "analysis/5-2-a-ui-base/ui-spec.json",
      "analysis/6-quality/form-validation-spec.json",
      "analysis/5-2-b-state/state-map.json"
    ]
  }
}
